{
  "schema_version": "corpus.v1",
  "corpus_id": "corpus_0123456789abcdef",
  "generated_at": "2026-07-14T00:00:00Z",
  "subject": {
    "name": "Regression Commentator",
    "handles": ["regression"],
    "platforms": ["x", "newsletter"]
  },
  "items": [
    {
      "id": "item_0000000000000001",
      "external_id": "1",
      "platform": "x",
      "author": {"name": "Regression Commentator", "handle": "regression"},
      "content_type": "post",
      "text": "CPI eased to 2.1% year over year, based on the statistics bureau's original data. If it rebounds next month, this view fails.",
      "created_at": "2026-07-10T01:00:00Z",
      "url": "https://x.com/regression/status/1",
      "language": "en",
      "links": [
        {
          "url": "https://www.stats.gov.cn/data/cpi",
          "domain": "www.stats.gov.cn",
          "kind": "source"
        }
      ],
      "entities": {
        "tickers": [],
        "hashtags": [],
        "mentions": [],
        "organizations": ["National Bureau of Statistics"],
        "people": [],
        "locations": ["China"],
        "other": ["CPI"]
      },
      "metrics": {
        "available": true,
        "observed_at": "2026-07-10T02:00:00Z",
        "values": {"likes": 120, "reposts": 12, "views": 8000},
        "missing": ["replies", "bookmarks", "quotes"]
      },
      "provenance": {
        "rights_basis": "public",
        "records": [
          {
            "source_label": "regression fixture",
            "source_file": "fixture.json",
            "source_file_sha256": "aaaaaaaaaaaaaaaaaaaaaaaaaaaaaaaaaaaaaaaaaaaaaaaaaaaaaaaaaaaaaaaa",
            "source_record_index": 0,
            "source_record_id": "1",
            "source_url": "https://x.com/regression/status/1"
          }
        ],
        "transformations": ["canonical_urls"]
      }
    },
    {
      "id": "item_0000000000000002",
      "external_id": "2",
      "platform": "x",
      "author": {"name": "Regression Commentator", "handle": "regression"},
      "content_type": "post",
      "text": "A friend says the AI trade is crowded; if $NVDA breaks support, forced selling may follow.",
      "created_at": "2026-07-11T01:00:00Z",
      "url": "https://x.com/regression/status/2",
      "language": "en",
      "links": [
        {
          "url": "https://X.COM/market/status/99",
          "domain": "X.COM",
          "kind": "external"
        }
      ],
      "entities": {
        "tickers": ["NVDA"],
        "hashtags": [],
        "mentions": [],
        "organizations": [],
        "people": [],
        "locations": [],
        "other": ["AI", "ETF"]
      },
      "metrics": {
        "available": false,
        "observed_at": null,
        "values": {},
        "missing": ["likes", "reposts", "replies", "views", "bookmarks", "quotes"]
      },
      "provenance": {
        "rights_basis": "public",
        "records": [
          {
            "source_label": "regression fixture",
            "source_file": "fixture.json",
            "source_file_sha256": "aaaaaaaaaaaaaaaaaaaaaaaaaaaaaaaaaaaaaaaaaaaaaaaaaaaaaaaaaaaaaaaa",
            "source_record_index": 1,
            "source_record_id": "2",
            "source_url": "https://x.com/regression/status/2"
          }
        ],
        "transformations": ["canonical_urls"]
      }
    },
    {
      "id": "item_0000000000000003",
      "external_id": "3",
      "platform": "newsletter",
      "author": {"name": "Regression Commentator", "handle": "regression"},
      "content_type": "newsletter",
      "text": "Reuters reports new chip export controls; the change may affect revenue and gross margin.",
      "created_at": "2026-07-12T01:00:00Z",
      "url": "https://example.substack.com/p/gpu-controls",
      "language": "en",
      "links": [
        {
          "url": "https://WWW.REUTERS.COM:443/technology/chips?utm_source=test",
          "domain": "WWW.REUTERS.COM",
          "kind": "citation"
        }
      ],
      "entities": {
        "tickers": [],
        "hashtags": [],
        "mentions": [],
        "organizations": ["Reuters"],
        "people": [],
        "locations": [],
        "other": ["GPU"]
      },
      "metrics": {
        "available": true,
        "observed_at": "2026-07-12T02:00:00Z",
        "values": {"likes": 40, "replies": 4},
        "missing": ["reposts", "views", "bookmarks", "quotes"]
      },
      "provenance": {
        "rights_basis": "public",
        "records": [
          {
            "source_label": "regression fixture",
            "source_file": "fixture.json",
            "source_file_sha256": "aaaaaaaaaaaaaaaaaaaaaaaaaaaaaaaaaaaaaaaaaaaaaaaaaaaaaaaaaaaaaaaa",
            "source_record_index": 2,
            "source_record_id": "3",
            "source_url": "https://example.substack.com/p/gpu-controls"
          }
        ],
        "transformations": ["canonical_urls"]
      }
    },
    {
      "id": "item_0000000000000004",
      "external_id": "4",
      "platform": "x",
      "author": {"name": "Regression Commentator", "handle": "regression"},
      "content_type": "post",
      "text": "Why are rate-cut expectations rising while Treasury yields make new highs? The valuation rerating is the question.",
      "created_at": "2026-07-13T01:00:00Z",
      "url": "https://x.com/regression/status/4",
      "language": "en",
      "links": [
        {
          "url": "https://polymarket.com/event/rates",
          "domain": "polymarket.com",
          "kind": "source"
        }
      ],
      "entities": {
        "tickers": [],
        "hashtags": [],
        "mentions": [],
        "organizations": [],
        "people": [],
        "locations": [],
        "other": ["Treasury yields"]
      },
      "metrics": {
        "available": false,
        "observed_at": null,
        "values": {},
        "missing": ["likes", "reposts", "replies", "views", "bookmarks", "quotes"]
      },
      "provenance": {
        "rights_basis": "public",
        "records": [
          {
            "source_label": "regression fixture",
            "source_file": "fixture.json",
            "source_file_sha256": "aaaaaaaaaaaaaaaaaaaaaaaaaaaaaaaaaaaaaaaaaaaaaaaaaaaaaaaaaaaaaaaa",
            "source_record_index": 3,
            "source_record_id": "4",
            "source_url": "https://x.com/regression/status/4"
          }
        ],
        "transformations": ["canonical_urls"]
      }
    }
  ],
  "provenance": {
    "rights_basis": "public",
    "source_label": "regression fixture",
    "inputs": [
      {
        "path": "fixture.json",
        "format": "json",
        "sha256": "aaaaaaaaaaaaaaaaaaaaaaaaaaaaaaaaaaaaaaaaaaaaaaaaaaaaaaaaaaaaaaaa",
        "records": 4
      }
    ],
    "normalized_at": "2026-07-14T00:00:00Z",
    "normalizer": {"name": "normalize_corpus.py", "version": "1.0.0"}
  },
  "stats": {
    "input_records": 4,
    "output_items": 4,
    "duplicates_removed": 0,
    "metrics_items": 2,
    "languages": {"en": 4},
    "platforms": {"newsletter": 1, "x": 3}
  },
  "quality": {
    "warnings": [],
    "skipped_records": 0,
    "duplicates_removed": 0
  }
}
